pi@asmpi5:~ $ lspci
0000:00:00.0 PCI bridge: Broadcom Inc. and subsidiaries Device 2712 (rev 21)
0000:01:00.0 PCI bridge: ASMedia Technology Inc. ASM1184e 4-Port PCIe x1 Gen2 Packet Switch
0000:02:01.0 PCI bridge: ASMedia Technology Inc. ASM1184e 4-Port PCIe x1 Gen2 Packet Switch
0000:02:03.0 PCI bridge: ASMedia Technology Inc. ASM1184e 4-Port PCIe x1 Gen2 Packet Switch
0000:02:05.0 PCI bridge: ASMedia Technology Inc. ASM1184e 4-Port PCIe x1 Gen2 Packet Switch
0000:02:07.0 PCI bridge: ASMedia Technology Inc. ASM1184e 4-Port PCIe x1 Gen2 Packet Switch
0001:00:00.0 PCI bridge: Broadcom Inc. and subsidiaries Device 2712 (rev 21)
0001:01:00.0 Ethernet controller: Device 1de4:0001

pi@asmpi5:~ $ lspci -vv
0000:00:00.0 PCI bridge: Broadcom Inc. and subsidiaries Device 2712 (rev 21) (prog-if 00 [Normal decode])
        Control: I/O- Mem- BusMaster+ SpecCycle- MemWINV- VGASnoop- ParErr- Stepping- SERR- FastB2B- DisINTx-
        Status: Cap+ 66MHz- UDF- FastB2B- ParErr- DEVSEL=fast >TAbort- <TAbort- <MAbort- >SERR- <PERR- INTx-
        Latency: 0
        Interrupt: pin A routed to IRQ 39
        Bus: primary=00, secondary=01, subordinate=06, sec-latency=0
        Memory behind bridge: [disabled] [32-bit]
        Prefetchable memory behind bridge: [disabled] [64-bit]
        Secondary status: 66MHz- FastB2B- ParErr- DEVSEL=fast >TAbort- <TAbort- <MAbort+ <SERR- <PERR-
        BridgeCtl: Parity- SERR- NoISA- VGA- VGA16- MAbort- >Reset- FastB2B-
                PriDiscTmr- SecDiscTmr- DiscTmrStat- DiscTmrSERREn-
        Capabilities: <access denied>
        Kernel driver in use: pcieport

0000:01:00.0 PCI bridge: ASMedia Technology Inc. ASM1184e 4-Port PCIe x1 Gen2 Packet Switch (prog-if 00 [Normal decode])
        Subsystem: ASMedia Technology Inc. ASM1184e 4-Port PCIe x1 Gen2 Packet Switch
        Control: I/O- Mem- BusMaster+ SpecCycle- MemWINV- VGASnoop- ParErr- Stepping- SERR- FastB2B- DisINTx+
        Status: Cap+ 66MHz- UDF- FastB2B- ParErr- DEVSEL=fast >TAbort- <TAbort- <MAbort- >SERR- <PERR- INTx-
        Latency: 0
        Interrupt: pin A routed to IRQ 40
        Bus: primary=01, secondary=02, subordinate=06, sec-latency=0
        I/O behind bridge: [disabled] [32-bit]
        Memory behind bridge: [disabled] [32-bit]
        Prefetchable memory behind bridge: [disabled] [64-bit]
        Secondary status: 66MHz- FastB2B- ParErr- DEVSEL=fast >TAbort- <TAbort- <MAbort- <SERR- <PERR-
        BridgeCtl: Parity- SERR+ NoISA- VGA- VGA16- MAbort- >Reset- FastB2B-
                PriDiscTmr- SecDiscTmr- DiscTmrStat- DiscTmrSERREn-
        Capabilities: <access denied>
        Kernel driver in use: pcieport

0000:02:01.0 PCI bridge: ASMedia Technology Inc. ASM1184e 4-Port PCIe x1 Gen2 Packet Switch (prog-if 00 [Normal decode])
        Subsystem: ASMedia Technology Inc. ASM1184e 4-Port PCIe x1 Gen2 Packet Switch
        Control: I/O- Mem- BusMaster+ SpecCycle- MemWINV- VGASnoop- ParErr- Stepping- SERR- FastB2B- DisINTx+
        Status: Cap+ 66MHz- UDF- FastB2B- ParErr- DEVSEL=fast >TAbort- <TAbort- <MAbort- >SERR- <PERR- INTx-
        Latency: 0
        Interrupt: pin A routed to IRQ 42
        Bus: primary=02, secondary=03, subordinate=03, sec-latency=0
        I/O behind bridge: [disabled] [32-bit]
        Memory behind bridge: [disabled] [32-bit]
        Prefetchable memory behind bridge: [disabled] [64-bit]
        Secondary status: 66MHz- FastB2B- ParErr- DEVSEL=fast >TAbort- <TAbort- <MAbort- <SERR- <PERR-
        BridgeCtl: Parity- SERR+ NoISA- VGA- VGA16- MAbort- >Reset- FastB2B-
                PriDiscTmr- SecDiscTmr- DiscTmrStat- DiscTmrSERREn-
        Capabilities: <access denied>
        Kernel driver in use: pcieport

0000:02:03.0 PCI bridge: ASMedia Technology Inc. ASM1184e 4-Port PCIe x1 Gen2 Packet Switch (prog-if 00 [Normal decode])
        Subsystem: ASMedia Technology Inc. ASM1184e 4-Port PCIe x1 Gen2 Packet Switch
        Control: I/O- Mem- BusMaster+ SpecCycle- MemWINV- VGASnoop- ParErr- Stepping- SERR- FastB2B- DisINTx+
        Status: Cap+ 66MHz- UDF- FastB2B- ParErr- DEVSEL=fast >TAbort- <TAbort- <MAbort- >SERR- <PERR- INTx-
        Latency: 0
        Interrupt: pin A routed to IRQ 44
        Bus: primary=02, secondary=04, subordinate=04, sec-latency=0
        I/O behind bridge: [disabled] [32-bit]
        Memory behind bridge: [disabled] [32-bit]
        Prefetchable memory behind bridge: [disabled] [64-bit]
        Secondary status: 66MHz- FastB2B- ParErr- DEVSEL=fast >TAbort- <TAbort- <MAbort- <SERR- <PERR-
        BridgeCtl: Parity- SERR+ NoISA- VGA- VGA16- MAbort- >Reset- FastB2B-
                PriDiscTmr- SecDiscTmr- DiscTmrStat- DiscTmrSERREn-
        Capabilities: <access denied>
        Kernel driver in use: pcieport

0000:02:05.0 PCI bridge: ASMedia Technology Inc. ASM1184e 4-Port PCIe x1 Gen2 Packet Switch (prog-if 00 [Normal decode])
        Subsystem: ASMedia Technology Inc. ASM1184e 4-Port PCIe x1 Gen2 Packet Switch
        Control: I/O- Mem- BusMaster+ SpecCycle- MemWINV- VGASnoop- ParErr- Stepping- SERR- FastB2B- DisINTx+
        Status: Cap+ 66MHz- UDF- FastB2B- ParErr- DEVSEL=fast >TAbort- <TAbort- <MAbort- >SERR- <PERR- INTx-
        Latency: 0
        Interrupt: pin A routed to IRQ 45
        Bus: primary=02, secondary=05, subordinate=05, sec-latency=0
        I/O behind bridge: [disabled] [32-bit]
        Memory behind bridge: [disabled] [32-bit]
        Prefetchable memory behind bridge: [disabled] [64-bit]
        Secondary status: 66MHz- FastB2B- ParErr- DEVSEL=fast >TAbort- <TAbort- <MAbort- <SERR- <PERR-
        BridgeCtl: Parity- SERR+ NoISA- VGA- VGA16- MAbort- >Reset- FastB2B-
                PriDiscTmr- SecDiscTmr- DiscTmrStat- DiscTmrSERREn-
        Capabilities: <access denied>
        Kernel driver in use: pcieport

0000:02:07.0 PCI bridge: ASMedia Technology Inc. ASM1184e 4-Port PCIe x1 Gen2 Packet Switch (prog-if 00 [Normal decode])
        Subsystem: ASMedia Technology Inc. ASM1184e 4-Port PCIe x1 Gen2 Packet Switch
        Control: I/O- Mem- BusMaster+ SpecCycle- MemWINV- VGASnoop- ParErr- Stepping- SERR- FastB2B- DisINTx+
        Status: Cap+ 66MHz- UDF- FastB2B- ParErr- DEVSEL=fast >TAbort- <TAbort- <MAbort- >SERR- <PERR- INTx-
        Latency: 0
        Interrupt: pin A routed to IRQ 46
        Bus: primary=02, secondary=06, subordinate=06, sec-latency=0
        I/O behind bridge: [disabled] [32-bit]
        Memory behind bridge: [disabled] [32-bit]
        Prefetchable memory behind bridge: [disabled] [64-bit]
        Secondary status: 66MHz- FastB2B- ParErr- DEVSEL=fast >TAbort- <TAbort- <MAbort- <SERR- <PERR-
        BridgeCtl: Parity- SERR+ NoISA- VGA- VGA16- MAbort- >Reset- FastB2B-
                PriDiscTmr- SecDiscTmr- DiscTmrStat- DiscTmrSERREn-
        Capabilities: <access denied>
        Kernel driver in use: pcieport

0001:00:00.0 PCI bridge: Broadcom Inc. and subsidiaries Device 2712 (rev 21) (prog-if 00 [Normal decode])
        Control: I/O- Mem+ BusMaster+ SpecCycle- MemWINV- VGASnoop- ParErr- Stepping- SERR- FastB2B- DisINTx-
        Status: Cap+ 66MHz- UDF- FastB2B- ParErr- DEVSEL=fast >TAbort- <TAbort- <MAbort- >SERR- <PERR- INTx-
        Latency: 0
        Interrupt: pin A routed to IRQ 47
        Bus: primary=00, secondary=01, subordinate=01, sec-latency=0
        Memory behind bridge: 00000000-005fffff [size=6M] [32-bit]
        Prefetchable memory behind bridge: [disabled] [64-bit]
        Secondary status: 66MHz- FastB2B- ParErr- DEVSEL=fast >TAbort- <TAbort- <MAbort- <SERR- <PERR-
        BridgeCtl: Parity- SERR- NoISA- VGA- VGA16- MAbort- >Reset- FastB2B-
                PriDiscTmr- SecDiscTmr- DiscTmrStat- DiscTmrSERREn-
        Capabilities: <access denied>
        Kernel driver in use: pcieport

0001:01:00.0 Ethernet controller: Device 1de4:0001
        Control: I/O- Mem+ BusMaster+ SpecCycle- MemWINV- VGASnoop- ParErr- Stepping- SERR- FastB2B- DisINTx+
        Status: Cap+ 66MHz- UDF- FastB2B- ParErr- DEVSEL=fast >TAbort- <TAbort- <MAbort- >SERR- <PERR- INTx-
        Latency: 0
        Interrupt: pin A routed to IRQ 47
        Region 0: Memory at 1f00410000 (32-bit, non-prefetchable) [size=16K]
        Region 1: Memory at 1f00000000 (32-bit, non-prefetchable) [virtual] [size=4M]
        Region 2: Memory at 1f00400000 (32-bit, non-prefetchable) [size=64K]
        Capabilities: <access denied>
        Kernel driver in use: rp1 